{
  "$schema": "desktop-node-feature-surface-ledger.schema.json",
  "schema_version": 1,
  "contract": "pcv-feature-surface-ledger-v1",
  "target_surfaces": [
    "api",
    "cli",
    "web"
  ],
  "features": [
    {
      "feature_id": "pcv.runtime.policy",
      "title": "Runtime policy",
      "routes": [
        {
          "operation_id": "runtime.policy",
          "method": "GET",
          "route_template": "/api/v1/runtime/policy",
          "required_permission": null,
          "present_surfaces": [
            "api",
            "cli",
            "web"
          ],
          "excluded_surfaces": [],
          "surface_bindings": {
            "web": {
              "coverage_id": "runtime.policy"
            },
            "cli": {
              "command": [
                "runtime",
                "policy"
              ]
            }
          }
        }
      ]
    },
    {
      "feature_id": "pcv.host.status",
      "title": "Host status",
      "routes": [
        {
          "operation_id": "host.status",
          "method": "GET",
          "route_template": "/api/v1/host/status",
          "required_permission": "read",
          "present_surfaces": [
            "api",
            "cli",
            "web"
          ],
          "excluded_surfaces": [],
          "surface_bindings": {
            "web": {
              "coverage_id": "host.status"
            },
            "cli": {
              "command": [
                "host",
                "status"
              ]
            }
          }
        }
      ]
    },
    {
      "feature_id": "pcv.vm.inventory",
      "title": "VM inventory",
      "routes": [
        {
          "operation_id": "vm.list",
          "method": "GET",
          "route_template": "/api/v1/vms",
          "required_permission": "read",
          "present_surfaces": [
            "api",
            "cli",
            "web"
          ],
          "excluded_surfaces": [],
          "surface_bindings": {
            "web": {
              "coverage_id": "vm.list"
            },
            "cli": {
              "command": [
                "vm",
                "list"
              ]
            }
          }
        },
        {
          "operation_id": "vm.detail",
          "method": "GET",
          "route_template": "/api/v1/vms/{vmId}",
          "required_permission": "read",
          "present_surfaces": [
            "api",
            "cli",
            "web"
          ],
          "excluded_surfaces": [],
          "surface_bindings": {
            "web": {
              "coverage_id": "vm.detail"
            },
            "cli": {
              "command": [
                "vm",
                "get",
                "vm-01"
              ]
            }
          }
        }
      ]
    },
    {
      "feature_id": "pcv.job.lifecycle",
      "title": "Job lifecycle",
      "routes": [
        {
          "operation_id": "job.list",
          "method": "GET",
          "route_template": "/api/v1/jobs",
          "required_permission": "read",
          "present_surfaces": [
            "api",
            "cli",
            "web"
          ],
          "excluded_surfaces": [],
          "surface_bindings": {
            "web": {
              "coverage_id": "job.list"
            },
            "cli": {
              "command": [
                "job",
                "list"
              ]
            }
          }
        },
        {
          "operation_id": "job.detail",
          "method": "GET",
          "route_template": "/api/v1/jobs/{jobId}",
          "required_permission": "read",
          "present_surfaces": [
            "api",
            "cli",
            "web"
          ],
          "excluded_surfaces": [],
          "surface_bindings": {
            "web": {
              "coverage_id": "job.detail"
            },
            "cli": {
              "command": [
                "job",
                "get",
                "job-01"
              ]
            }
          }
        },
        {
          "operation_id": "job.cancel",
          "method": "POST",
          "route_template": "/api/v1/jobs/{jobId}/cancel",
          "required_permission": "operate",
          "present_surfaces": [
            "api",
            "cli",
            "web"
          ],
          "excluded_surfaces": [],
          "surface_bindings": {
            "web": {
              "coverage_id": "job.cancel"
            },
            "cli": {
              "command": [
                "job",
                "cancel",
                "job-01"
              ]
            }
          }
        },
        {
          "operation_id": "job.retry",
          "method": "POST",
          "route_template": "/api/v1/jobs/{jobId}/retry",
          "required_permission": "operate",
          "present_surfaces": [
            "api",
            "cli",
            "web"
          ],
          "excluded_surfaces": [],
          "surface_bindings": {
            "web": {
              "coverage_id": "job.retry"
            },
            "cli": {
              "command": [
                "job",
                "retry",
                "job-01"
              ]
            }
          }
        },
        {
          "operation_id": "job.reconcile",
          "method": "POST",
          "route_template": "/api/v1/jobs/{jobId}/reconcile",
          "required_permission": "operate",
          "present_surfaces": [
            "api",
            "cli",
            "web"
          ],
          "excluded_surfaces": [],
          "surface_bindings": {
            "web": {
              "coverage_id": "job.reconcile"
            },
            "cli": {
              "command": [
                "job",
                "reconcile",
                "job-01"
              ]
            }
          }
        }
      ]
    },
    {
      "feature_id": "pcv.ops.summary",
      "title": "Operations summary",
      "routes": [
        {
          "operation_id": "ops.summary",
          "method": "GET",
          "route_template": "/api/v1/ops/summary",
          "required_permission": "read",
          "present_surfaces": [
            "api",
            "cli",
            "web"
          ],
          "excluded_surfaces": [],
          "surface_bindings": {
            "web": {
              "coverage_id": "ops.summary"
            },
            "cli": {
              "command": [
                "ops",
                "summary"
              ]
            }
          }
        }
      ]
    },
    {
      "feature_id": "pcv.diagnostics.bundle",
      "title": "Diagnostic bundles",
      "routes": [
        {
          "operation_id": "diagnostic.bundle.list",
          "method": "GET",
          "route_template": "/api/v1/diagnostics/bundles",
          "required_permission": "diagnostics.read",
          "present_surfaces": [
            "api",
            "cli",
            "web"
          ],
          "excluded_surfaces": [],
          "surface_bindings": {
            "web": {
              "coverage_id": "diagnostic.bundle.list"
            },
            "cli": {
              "command": [
                "diagnostics",
                "bundle",
                "list"
              ]
            }
          }
        },
        {
          "operation_id": "diagnostic.bundle.create",
          "method": "POST",
          "route_template": "/api/v1/diagnostics/bundles",
          "required_permission": "diagnostics.create",
          "present_surfaces": [
            "api",
            "cli",
            "web"
          ],
          "excluded_surfaces": [],
          "surface_bindings": {
            "web": {
              "coverage_id": "diagnostic.bundle.create"
            },
            "cli": {
              "command": [
                "diagnostics",
                "bundle",
                "create"
              ]
            }
          }
        },
        {
          "operation_id": "diagnostic.bundle.download",
          "method": "GET",
          "route_template": "/api/v1/diagnostics/bundles/{bundleId}/download",
          "required_permission": "diagnostics.read",
          "present_surfaces": [
            "api",
            "cli",
            "web"
          ],
          "excluded_surfaces": [],
          "surface_bindings": {
            "web": {
              "coverage_id": "diagnostic.bundle.download"
            },
            "cli": {
              "command": [
                "diagnostics",
                "bundle",
                "download",
                "bundle-01",
                "--output",
                "D:\\evidence\\bundle.json"
              ]
            }
          }
        }
      ]
    },
    {
      "feature_id": "pcv.account.session",
      "title": "Account and RBAC session",
      "routes": [
        {
          "operation_id": "auth.login",
          "method": "POST",
          "route_template": "/api/v1/auth/login",
          "required_permission": null,
          "present_surfaces": [
            "api",
            "web"
          ],
          "excluded_surfaces": [
            {
              "surface": "cli",
              "reason": "Account and JWT session lifecycle is Web/API-only; PCVCLI uses protected bearer-token resolution."
            }
          ],
          "surface_bindings": {
            "web": {
              "coverage_id": "auth.login"
            }
          }
        },
        {
          "operation_id": "auth.loopback-session",
          "method": "POST",
          "route_template": "/api/v1/auth/loopback-session",
          "required_permission": null,
          "present_surfaces": [
            "api",
            "web"
          ],
          "excluded_surfaces": [
            {
              "surface": "cli",
              "reason": "Account and JWT session lifecycle is Web/API-only; PCVCLI uses protected bearer-token resolution."
            }
          ],
          "surface_bindings": {